Title,Author,Text,Resource,Label
Georgia’s Fulton County Recount Delayed After Dominion Server Crash,['Hannah Bleau'],"The recount requested by President Trump’s campaign in Georgia’s Fulton County experienced a delay after a Dominion Voting Systems mobile server crashed on Sunday, according to Fulton County officials.

“Technicians from Dominion have been dispatched to resolve the issue,” Fulton County officials said in a statement after the server crashed on Sunday. “The Georgia Secretary of State’s office has also been alerted to the issue and is aware of efforts to resolve the problem.”

Dominion has remained at the center of claims of error and fraud in the 2020 election. While Sidney Powell is not formally part of President Trump’s legal team, she participated in a joint press conference with his campaign prior to Thanksgiving and detailed the purported issues with the voting machines.

As Breitbart News detailed:

Powell argued that U.S. votes were being counted overseas, and that Dominion voting machines and Smartmatic software were controlled by foreign interests, manipulating algorithms to change the results. Powell noted specifically that Smartmatic’s owners included two Venezuelan nationals, whom she alleged had ties to the regime of Hugo Chavez and Nicolas Maduro. The legal team alleged that there were statistical anomalies, such as huge batches of votes for Biden, that could not be explained except as manipulation — which, they alleged, happened in the wee hours of the morning as vote-counting had stalled. (The companies have disputed these allegations vigorously.)

Powell filed lawsuits challenging the election results in Georgia and Michigan last week, which contained the allegations she previewed at the press conference.

“Mathematical and statistical anomalies rising to the level of impossibilities, as shown by affidavits of multiple witnesses, documentation, and expert testimony evince this scheme across the state of Georgia,” Powell alleged, adding that “especially egregious conduct arose in Forsyth, Paulding, Cherokee, Hall, and Barrow County.”

Researchers have also questioned the reliability of the voting systems, noting that they “register votes in bar codes that the human eye cannot decipher” which could give voters “printouts that accurately spell out the names of the candidates they picked, but, because of a hack, the bar codes do not reflect those choices.”

In October, the Atlanta Journal-Constitution (AJC) warned that Georgia’s newly implemented Dominion voting system was vulnerable to cyberattacks. It also noted that Texas rejected the Dominion equipment due to “multiple hardware issues.”

Top Democrats, including Sens. Elizabeth Warren (MA), Amy Klobuchar (MN), and Ron Wyden (OR) also signaled concern over Dominion’s technology in 2019. In a letter to the private equity firms controlling the top U.S. election technology companies, the senators expressed concern over “vulnerabilities and a lack of transparency in the election technology industry and the poor condition of voting machines and other election technology equipment.”

However, Dominion has fervently denied what it called “false assertions about vote switching and software issues” with their voting systems, and Georgia Gov. Brian Kemp (R) has dismissed Powell’s accusations.

Fulton and the remaining 158 counties have until December 2 to complete the requested recount.",BreitBart,-1
Trump Urges Georgia Governor to Strengthen Recount,['Charlie Spiering'],"President Donald Trump on Monday warned Georgia Gov. Brian Kemp (R) of a “goldmine of fraud” without signature matching for mail-in ballots in the state recount.

“Why won’t Governor Brian Kemp, the hapless Governor of Georgia, use his emergency powers, which can be easily done, to overrule his obstinate Secretary of State, and do a match of signatures on envelopes,” Trump asked, referring to Georgia Secretary of State Brad Raffensperger (R).

Trump channeled anger from Georgia state Republicans about the election results and the subsequent hand recounts that did not revisit the signature verification.

“Georgia Republicans are angry, all Republicans are angry. Get it done!” he wrote.

Raffensperger has claimed that matching the signatures is no longer possible because the ballots have been separated from the outer envelope.

But Trump argued that verifying the signatures in the recount would eliminate any potential fraud — both in the 2020 election and the Georgia Senate runoff election.

“It will be a ‘goldmine’ of fraud, and we will easily WIN the state,” Trump wrote.

The president also questioned whether the number of envelopes matched up with the number of ballots cast in the Georgia 2020 election, suggesting there were other signs of fraud.

“Also, quickly check the number of envelopes versus the number of ballots,” he wrote. “You may just find that there are many more ballots than there are envelopes. So simple, and so easy to do.”",BreitBart,-1
Newt Gingrich: America's Future Depends on Georgia's Senate Races,['Robert Kraychik'],"America’s future depends on the outcomes of the elections for the U.S. Senate in Georgia, said former Speaker of the House Newt Gingrich (R-GA) on Monday, offering his remarks on SiriusXM’s Breitbart News Daily with host Alex Marlow.

Marlow asked about demoralization among conservatives and Republicans in Georgia rooted in mistrust of the electoral and political systems.

“A lot of people in the audience are discouraged,” Marlow stated. “I don’t think it’s the majority, by any means, but there’s certainly a number of people who’ve been pretty vocal that they’re discouraged. They think the election process — if it’s not going to be legitimate — then there’s no point in voting and they don’t want to vote. They’re going protest in Georgia by not voting. I would like to hope it’s a small number of people, but a small number of people could swing the whole election. Do you have a message for those people?”

Gingrich urged Georgians to vote and volunteer as poll watchers.

LISTEN:

Gingrich continued with this advice, “My message is very simple. The future of the United States depends on the outcome of the Georgia Senate races. If you don’t want a radical left-wing America dominated by left-wing judges with massive tax increases, with a policy, frankly, of appeasing China, and you don’t want that kind of future, you have to go out and vote. And then frankly, you have to volunteer as a poll watcher and make sure they don’t steal the election. But I think these things are vital and I don’t think we should in any way underestimate how really important the Georgia Senate race.”

The 2020 election “may be the biggest Presidential theft since Adams and Clay robbed Andrew Jackson in 1824,” wrote Gingrich on Friday via Twitter.

The more data comes out on vote anomalies that clearly are not legitimate the more it looks like 2020 may be the biggest Presidential theft since Adams and Clay robbed Andrew Jackson in 1824. State legislatures should demand recounts — Newt Gingrich (@newtgingrich) November 27, 2020

Gingrich contrasted 1824’s presidential election with 2020’s.

“In 1824, Andrew Jackson had At 40 percent of the popular vote, but the guys who came in number two and three combined in the House of Representatives of John Quincy Adams and Henry Clay decided that even though Jackson got the most votes, he wouldn’t be president,” Gingrich explained. “So Jackson spent the next four years attacking them for representing a corrupt establishment and decisively beat Adams in 1828, and really the caused a dramatic uprising against the old order because people were just sick of it.”

Everything hinges on Georgia's January 5th Senate runoff. https://t.co/obPHqU9nmk — Breitbart News (@BreitbartNews) November 26, 2020

Gingrich warned Democrats focus on election mechanics while Republicans focus on political campaigning. He highlighted get-out-the-vote efforts funded by Mark Zuckerberg and other left-wing billionaires and Democrat-driven election law changes as examples of Democrats’ focus on electioneering.

“You have to think of two parallel projects,” determined Gingrich. “There is the campaign, which is what the Republicans focus on, and there is the election, which is what the Democrats focus on. If we don’t find a way to have an honest election, the campaign won’t matter, because we will be drowned in ballots that are illegally gathered [through] harvested ballots.”

Gingrich concluded, “These two Senate seats are the margin between containing Biden and empowering Biden.”",BreitBart,-1
VIDEO: Trump Supporters Rally Outside GA Secretary of State's Home,['Amy Furr'],"About 200 of President Donald Trump’s supporters rallied outside Georgia Secretary of State Brad Raffensperger’s (R) Atlanta home on Saturday to protest the election results.

“Trucks flying Trump and ‘Stop the Steal’ flags drove up and down the street outside of Secretary Brad Raffensperger’s property, honking their horns as they passed by,” Fox 5 reported.

Organizer Ursula Christie told the outlet she wanted Raffensperger to know “we are silent no more and we want him to know that we are watching and we are listening and we are aware of the actions being taken.”

Raffensperger, a Republican, said he voted for Trump but has received criticism for his handling of the election.

“On Thanksgiving Day, Trump called Georgia’s election was [sic] part of a ‘fraudulent system’ and said Raffensperger was an ‘enemy of the people,'” the Fox 5 report continued.

During an interview with CNN’s Jake Tapper on November 18, Raffensperger dismissed allegations of voter fraud in his state but acknowledged the possibility of clerical errors:

We have not seen any widespread voter fraud. The president has picked up some votes in a few of the counties that made some clerical errors. It wasn’t the machines. But at the end of the day, he started with 14,000. He’s about 12,000 now. But we’re finishing up, waiting for a few more counties to get back to us, large counties, but I don’t believe at the end of the day it will change the total results.

When asked if he believed former Vice President Joe Biden would win Georgia, Raffensperger said “Yes, I believe that’s the way it will turn out.”

However, in a Friday tweet, Trump said “Biden can only enter the White House as President if he can prove that his ridiculous ‘80,000,000 votes’ were not fraudulently or illegally obtained.”

“When you see what happened in Detroit, Atlanta, Philadelphia & Milwaukee, massive voter fraud, he’s got a big unsolvable problem!” he concluded.",BreitBart,-1
Trump: ‘I’m Ashamed that I Endorsed’ Governor Kemp in Georgia,['Pam Key'],"""I'm ashamed that I endorsed him"" -- Trump disses Brian Kemp for not doing more to help him steal the election in Georgia pic.twitter.com/pCgF7dFIk2

President Donald Trump said during a phone interview on this week’s broadcast of Fox News Channel’s “Sunday Morning Futures with Maria Bartiromo” that he regretted endorsing Gov. Brian Kemp (R-GA).

Discussing the 2020 presidential election in Georgia, Trump said, “Everything has to be approved by the legislature, and they had judges making deals, and they had electoral officials making deals, like this character in Georgia who’s a disaster.”

He added, “And the governor’s done nothing. He’s done absolutely nothing. I’m ashamed that I endorsed him. But I look what’s going on. It’s so terrible. What happened in this election, Maria, I can’t imagine has ever happened before.”

Follow Pam Key on Twitter @pamkeyNEN",BreitBart,-1
Trump Urges Supporters to Vote for Kelly Loeffler and David Perdue,['Charlie Spiering'],"President Donald Trump on Friday told his supporters to defend the Republican Senate majority by backing Sens. Kelly Loeffler (R-GA) and David Perdue (R-GA) in the Georgia runoff elections.

The president reacted to a Newsmax article about Trump supporters in Georgia considering a boycott of the election.

“No, the 2020 Election was a total scam, we won by a lot (and will hopefully turn over the fraudulent result), but we must get out and help David and Kelly, two GREAT people,” Trump wrote on Twitter.

No, the 2020 Election was a total scam, we won by a lot (and will hopefully turn over the fraudulent result), but we must get out and help David and Kelly, two GREAT people. Otherwise we are playing right into the hands of some very sick people. I will be in Georgia on Saturday! https://t.co/1ziqFq9S6O — Donald J. Trump (@realDonaldTrump) November 27, 2020

Many Trump supporters are enraged by their state GOP representatives in Georgia, accusing them of failing to back the president in a contentious recount in which former Vice President Joe Biden still holds a roughly 12,000 vote lead.

But Trump said that a boycott would only help Democrats.

“Otherwise we are playing right into the hands of some very sick people,” he wrote.

As Breitbart News reported, Democrats are already exploiting tensions in the state by spreading the message that Republicans should not back the Georgia Republican candidates because of their failure to fight for the president.

Trump’s son Donald Trump Jr. has also opposed any boycotts.

“That is NONSENSE. IGNORE those people,” he wrote on Twitter. “We need ALL of our people coming out to vote for Kelly & David.”

Trump again promised to hold a campaign rally for Loeffler and Perdue as Republicans work to maintain control of their Senate majority.

“I will be in Georgia on Saturday!” he wrote, referring to his planned rally for December 5.

The president is watching the race closely as Democrats work to flip the state and seize control of the Senate.

Trump described Perdue’s Democrat opponent, Jon Ossoff, as a “lightweight” in a conversation with reporters on Thursday and Loeffler’s opponent, Raphael Warnock, as “either a communist or a socialist. I cannot figure that out yet.”

The Georgia runoff election will take place on January 5.",BreitBart,-1
Hollywood Storms Georgia: Kevin Bacon Hosting Celebrity Fundraiser for Pro-Democrat Group,['David Ng'],"Georgia is ground zero in the battle for the balance of power in Washington, D.C., as control of the U.S. Senate now hinges on the outcome of the two Senate runoff races in the Peach State. With the Senate majority leadership within his reach, Sen. Chuck Schumer (D-NY) recently declared, “Now we take Georgia, and then we change America.” Now Kevin Bacon and Kyra Sedgwick are reportedly the latest Hollywood celebrities to lend their star power to Democrats in Georgia, hoping to boost the chances of candidates Raphael Warrnock and Jon Ossoff and turn the Senate blue.

The acting power couple will join comedian Billy Eichner and Hamilton star Leslie Odom Jr. in a fundraiser for Swing Left, one of many progressive organizations that is mobilizing Democratic turnout in Georgia, according to The Hollywood Reporter. The Maze Runner producer Ellen Goldsmith-Vein will co-host the December 3 event.

Swing Left is among the many progressive groups that have set their sights on Georgia ahead of the state’s January 5 runoffs. The organization, which was founded in the wake of President Trump’s 2016 victory, has specialized in recruiting celebrities to push its agenda, including Broadway and Homeland star Mandy Patinkin.

Kevin Bacon and Kyra Sedgwick teamed up with Swing Left in the weeks leading up to the presidential election, participating in podcasts and donating money to the group.

Hollywood celebrities have made Georgia their top political priority in their effort to push Jon Ossoff and Raphael Warnock across the finish line. A-list stars including George Clooney and Will Smith have poured money into the races, while actors Kumail Nanjiani and Sophia Bush are spearheading WinBothSeats, an initiative to get out the minority vote for Democrats.

Julia Louis-Dreyfus is holding a Veep reunion next month to raise money for America Votes, the left-wing group that is working to boost Democratic chances in Georgia’s runoffs. Other stars pushing Georgia Democrats on social media include Alyssa Milano and Debra Messing.

Follow David Ng on Twitter @HeyItsDavidNg. Have a tip? Contact me at dng@breitbart.com",BreitBart,-1
Donald Trump Says He Will Campaign in Georgia December 5,['Charlie Spiering'],"President Donald Trump said Thursday that he would campaign in Georgia Saturday, December 5, to help Republicans in the Senate runoff election.

“I’m going on Saturday night. I’ll be in Georgia. We’ll have a tremendous crowd,” Trump told reporters after speaking to members of the Armed Forces in a teleconference call.

The White House clarified after Trump’s remarks that he would campaign in the state on Saturday, December 5.

Both Republican Sens. David Perdue and Kelly Loeffler face a runoff election on January 5, as Republicans try to hold on to their Senate majority.

“Maybe I’ll go twice. That’s very important that we win those races. These are great people,” Trump said.

Trump described Perdue’s Democrat opponent, Jon Ossoff, as a “lightweight” and Loeffler’s opponent, Raphael Warnock, as “either a communist or a socialist. I cannot figure that out yet.”

“This is not for Georgia,” Trump said.

Trump said that he warned Perdue and Loeffler of the voting system in the state of Georgia.

“Listen, you have a fraudulent system. You have to be very careful,” he recalled telling them.

Trump said that because of the coronavirus pandemic, he would probably host an outdoor rally in Georgia, most likely at an airport.

“They’re looking for the right site,” he said.

Trump disputed a reporter’s assertion that this was his last Thanksgiving in the White House.

“Well we don’t know what is last — if you look at what’s going on. … They’re finding tremendous discrepancies in the votes, and nobody believes those numbers. Those numbers are incorrect numbers.”

He predicted that more evidence of voter fraud would come out in a number of weeks.

“We’ll see what happens. Nobody wants to see the kind of fraud that this election has really come to represent,” he said.

Trump said he would continue fighting the election results, noting that former Vice President Joe Biden and Sen. Kamala Harris opposed his policy of “America First.”

“You can’t have somebody assume office and already they want to get rid of ‘America First.’ … You know why?” he asked. “Because China doesn’t want it.”

One reporter asked Trump if he would concede the presidential election if the electoral college voted for Biden on December 14.

“It’s going to be a very hard thing to concede because we know there was massive fraud, so as to whether or not I can get this apparatus moving this quickly, because time is not on our side. Everything else is on our side. Facts are on our side,” he said. “This was a massive fraud.”",BreitBart,-1
Stacey Abrams to Coach Hollywood Elites on How They Can Help Win Georgia,['Alana Mastrangelo'],"Georgia is now ground zero for the battle for the balance of power in Washington, D.C., as control of the U.S. Senate now hinges on the outcome of the two Senate runoff races. With the Senate majority leadership just a couple seats away, Sen. Chuck Schumer (D-NY) recently declared, “Now we take Georgia, and then we change America.” And failed Georgia gubernatorial candidate and Democratic Party power player Stacey Abrams is more than willing to do her part to see that Schumer’s goal is realized.

Starting on Friday, Abrams will brief Hollywood agents, managers, publicists, and entertainment executives on how they can help elect Georgia U.S. Senate Democrat candidates Jon Ossoff and Raphael Warnock ahead of the runoff elections in according to the Hollywood Reporter.

On January 5, Georgia will have its runoff elections between senator Kelly Loeffler (R) and candidate Raphael Warnockas (D), as well as senator David Perdue (R) and candidate Jon Ossoff (D).

Abrams’ organization Fair Fight is enlisting celebrities like Selena Gomez, Yara Shahidi, Issa Rae, Keke Palmer and Steph Curry for voting videos, as well as dumping millions of dollars to assist over a dozen organizations in their efforts ahead of the runoffs.

“I believe very much in the power of celebrity to cut through the noise of politics,” Abrams said last week.

Celebrities also now believe that they have a vested interest in the turning the state blue, as tax incentives have brought Hollywood productions from California to Georgia in recent years, bringing the celebrities and other staff to the traditionally red state.

“Being someone who worked in Georgia for two years while I shot [Netflix series] Insatiable, I’m really aware of how powerful and impactful the organizers are,” said actress and political activist Alyssa Milano.

New Georgia Project executive director Nse Ufot echoed those sentiments.

“We’ve been talking for quite a bit of time about how we are trying to change the culture of voting — what better way to do that than by partnering with culture workers, people who are literally responsible for helping us shift the narrative and tell better stories about ourselves,” said Ufot. “Our state is growing by leaps and bounds because of an influx of storytellers and people who support them. I think that that could be a secret weapon as we think about the new Georgia.”

LaTosha Brown, the co-founder of the Marxist political organization Black Voters Matter, echoed those sentiments as well, and claimed, “we’re not the headquarters for Southern white male racists” now that Hollywood has imposed itself.

“We’ve seen this transition — Georgia is the number one place for film productions, so this city has become more internationalized, I think one,” said Brown. “I think it’s been attractive to bringing diverse folks to the state.”

You can follow Alana Mastrangelo on Facebook and Twitter at @ARmastrangelo, on Parler at @alana, and on Instagram.",BreitBart,-1
