Title,Author,Text,Resource,Label
76 Franciscan Nuns From Same German Monastery Test Corona Positive,['Breitbart London'],"BERLIN (AP) – Seventy-six Catholic nuns have tested positive for COVID-19 after an outbreak at a Franciscan convent in northwestern Germany, church authorities said Tuesday.

Another 85 nuns received negative test results at the monastery in Thuine, not far from the Dutch border, the convent’s Mother Superior told The Associated Press.

“We are grateful that so far nobody is in the hospital,” Sister Maria Cordis Reiker said.

Local health authorities put the the entire monastery under quarantine late last week after the first cases of coronavirus were discovered there. Most Catholic nuns in Germany are elderly women because convents have had difficulties for decades recruiting young women for their cause.

Reiker said they were still waiting for the test results of the 160 non-clerical employees of the monastery, including nurses working at the monastery’s old people’s home, and others working at the monastery’s kitchen and wash house.

The nuns also run a boys´ boarding school and several other schools including a vocational school.

“We don’t know how things will continue regarding our schools, it’s all still in flux,” she said.

She said local health and school officials were in touch with the schools.

Overall in Germany, 13,604 more people tested positive over the last 24 hours and 388 others died of COVID-19, the country’s national disease control center, the Robert Koch Institute, reported.

While the number of new virus cases among younger people is decreasing in Germany, it´s going up among older people, the institute said.",BreitBart,-1
Boris Faces Massive Tory Rebellion over Coronavirus Restrictions,['Victoria Friedman'],"Boris Johnson is facing a rebellion of up to 100 Conservative MPs planning to vote against putting 99 per cent of England under the top two strictest coronavirus measures.

The prime minister’s proposals from last week revealed that despite England being under a month-long lockdown during November, more of the country will find itself in a higher tier coming out of shutdown than going in, with just Cornwall, the Isles of Scilly, and the Isle of Wight in Tier 1.

Conservative MPs were outraged by the recommended demarcations, calling the measures “authoritarian”, with others saying that the “wheels are coming off the government’s arguments” to continue imposing them.

14.6 million more people in England are now in Tier 3 compared to pre-lockdown, when cases were also falling. Meanwhile, non-Covid deaths at home are rising way above the 5 year average as many are too scared or unable to get to hospital. Lockdowns don’t work. pic.twitter.com/wtNDkMJjli — The Brexit Party (@brexitparty_uk) November 29, 2020

MPs are set to vote on the measures in the House of Commons today, with media reporting that as many as between 50 and 100 Tories will rebel against their own government and vote against them, including Sir Graham Brady, chairman of the influential backbench 1922 Committee.

The Guardian has also reported that Labour plans to abstain from voting, because the financial support, derived from taxpayers, for the hospitality industry must go further than the government’s recovery package.

Tier 2 bans socialising indoors with anyone outside their house or support bubble and limits it to six outdoors, while Tier 3 prohibits any mixing with people not in your household or bubble inside or in most outdoor settings. Tier 3 also sees pubs, bars, and restaurants close unless they can function as takeaways, while in Tier 2, alcohol at hospitality venues can only be served with a ‘substantial meal’.

Conservative lockdown sceptics from the COVID Recovery Group won a minor battle in forcing the Johnson administration to release the impact assessments that informed the government’s decision, but MPs are said to be disappointed with the document, described as “thin” and containing a “rehashed” and frustrating analysis.

UK Minister: You Might Be Banned from Venues Without Vaccine Passport https://t.co/f0UOh7YnkY — Breitbart London (@BreitbartLondon) December 1, 2020

Chairman of the Covid Recovery Group, Mark Harper, said: “Even with so little time, the government’s analysis seems to be collapsing under the glare of scrutiny.

“Before the current lockdown, incorrect death and hospital capacity modelling was leaked into the public domain to justify it. We asked for full details. We have asked repeatedly for the information that vindicates these hospital projections, and they have not been forthcoming.

“We are now seeing that, once again, the wheels are coming off the government’s arguments.”

Former Conservative Party leader Sir Iain Duncan Smith called the document a “cut and paste job”, insinuating that the government had provided no new analysis at all.

However, despite the anticipated massive Tory rebellion and Labour abstaining, the proposals are expected to pass with support from the Conservative “payroll vote” government ministers and Johnson loyalists in the backbench, as well as a handful of Labour MPs defying Sir Keir Starmer.",BreitBart,-1
Tucker Carlson: ‘Dr. Fauci Was Revealed as a Power-Mad Incompetent’,['Jeff Poor'],"Monday, Fox News Channel’s Tucker Carlson opened his program questioning the decisions of National Institutes of Allergy and Infectious Diseases director Anthony Fauci, including closing down schools to children, a segment of the population that does not appear to be as vulnerable to the threat of COVID-19.

Carlson insisted Fauci could have intervened earlier and prevented Draconian measures from being taken with regards to coronavirus and education.

Transcript as follows:

CARLSON: I hope you had a great and relaxing Thanksgiving weekend, away from the endless drone of news. If you somehow managed to pull that off, a few days of peace and happiness with the ones you love, you found it was like a spa treatment. You’re obviously better off for it.

But you also may be wondering what happened? What did you miss over the weekend? And we’re here to tell you.

For starters, Joe Biden broke his foot in a couple of places. It sounds serious, but don’t worry about it. Biden was just out playing with his dog as healthy, vibrant adults in full command of their faculties are not at all fragile and fading often do. It could have happened to anyone. Seriously, it’s totally normal.

CNN, in fact, wrote a piece congratulating Biden for it. Biden’s injuries are far better than Donald Trump’s. So don’t ask questions. You’ve got bigger stories to worry about in the news landscape.

For example, did you hear that Joe Biden picked women to lead the White House Communications Office? That was a historic moment. Nothing like that has happened in this country since the presidency of Donald Trump. Another triumph for the forces of identity. Systemic sexism finally in retreat. Nothing can stop Joe Biden from smashing the glass ceiling, not even his dog.

So that’s what you missed.

Oh, and one other thing. The country’s public health establishment has tortured your children for eight months for no apparent reason. That happened. That story has not received a lot of coverage, but it has been confirmed tonight. The authorities have admitted 60 million American children languishing in their rooms since spring, sitting in front of screens, learning nothing, isolated from human contact, in many cases driven to mental illness.

We can now report there was no reason for any of that. The experts were wrong. They had no idea what they were doing. But the most amazing part — and this really is the headline of the story — is that they knew they were wrong when they did it. But they kept lying about it, even as American children began to kill themselves.

On Sunday in New York, city officials all but admitted this. They announced the reopening of elementary schools. Those are the same schools that they closed fewer than two weeks ago. Now, from a medical standpoint, nothing has changed. New York didn’t get an early shipment of the Pfizer vaccine. There wasn’t some groundbreaking new research paper that revolutionized our understanding of the coronavirus, nothing like that at all.

In fact, parents simply had enough and they forced Bill de Blasio to admit the obvious. This virus is not a threat to children. As de Blasio put it in that weird euphemistic way that dumb people speak, quote, “We know that the health realities for the youngest kids are the most favorable.” Well, yes, we do know that. We’ve known it for a long time. We knew it when Bill de Blasio shut down New York schools.

And Tony Fauci knew it, too, though he didn’t say anything about it. Now, he has decided to say something about it eight months late. Here’s Anthony Fauci on Sunday. And as you watch this, keep in mind that this man on the screen is leading our response, America’s response to the coronavirus.

(BEGIN VIDEO CLIP)

DR. ANTHONY FAUCI, DIRECTOR, NATIONAL INSTITUTE OF ALLERGY AND INFECTIOUS DISEASES: Close the bars and keep the schools open is what we really say. Obviously, you don’t have one size fits all. But as I’ve said in the past, and as you accurately quoted me, the default position should be to try as best as possible within reason to keep the children in school or to get them back to school.

If you look at the data, the spread among children and from children is not really very big at all. Not like one would have suspected.

(END VIDEO CLIP)

CARLSON: Oh, I’ve always said you should keep the schools open says the man in charge of America’s coronavirus response to a nation whose schools have been closed for months. Right. Yes, I always said that. Check the tape. Because, quote, “If you look at the data,” says Anthony Fauci.

But wait a second. Why is this just now occurring to Tony Fauci? Isn’t this Fauci’s entire job to quote, “look at the data”? Yes, it is. And yet somehow he never thought to do that. That’s our corona czar.

Over the summer when the data look the same as they do tonight, Fauci explained that he couldn’t really say, if kids should be allowed to go to school, it was quote, “complicated.” Except it wasn’t complicated. It wasn’t complicated then, it’s not complicated now.

In April, many months ago, a study by the “Journal of the American Medical Association” found that school-aged children who get the coronavirus, quote, “Develop only mild symptoms and typically recover within two weeks.” Months later, same story, in June, a study in “The Lancet” affirmed this, quote, “COVID-19 is generally a mild disease in children, including in infants.” Other studies found the exact same thing. No studies found anything but that. There was never much question about it.

But if you’re looking for more evidence, check the death rates. Those are publicly available. Deaths are not hard to track. Consider the State of New Jersey. That’s one of the states hit hardest by the coronavirus. So far in New Jersey, not a single school-aged child has died from the coronavirus, not one. Many children have died from car accidents and fires and drug ODs and suicide. None have died from COVID-19.

In California, the biggest state in the United States, 40 million people live there, a total of two people under the age of 18 have died from the coronavirus — two. The numbers nationwide according to the latest C.D.C. numbers, 123 Americans under the age of 18 have died from the coronavirus, 123 out of 350 million.

We shut the schools anyway, crushing millions of kids, affecting their futures in ways we can’t even understand at this point. But it’s clear it’s bad. Really bad in some cases.

So the question is, why did we do this? And the answer is to save the teachers. The teachers unions pushed this and their servants in the Democratic Party obey. They’re the single largest donors to the Democratic Party, so of course they did.

So unionized teachers get to stay home collecting checks, while you’re losing your jobs because classrooms are just too dangerous. It’s like the Battle of the Bulge five days a week. And that’s exactly what they’ve done.

But what does the data say about this? Well, for teachers under the age of 50, and that’s the vast majority of them, the odds of surviving a coronavirus infection are roughly 99.98 percent. But we should tell you that for teachers under 70, the risk of dying escalates to a terrifying 99.5 percent chance of survival. And by the way, teachers do get sick, it likely won’t be from teaching. Children appear not to spread the coronavirus, surely not effectively. We’ve done this for a long time.

Back in May, researchers in Europe found, quote, “Children do not appear to be drivers of transmission. And we argue that reopening schools should be considered safe accompanied by certain measures.” Again, none of this is new. Tony Fauci, that data guy knew it at the time. And so did anyone in the news media who could read which is still most of them, and yet they kept lying about it, all of them.

In July, here is just one example, a panel of physicians and experts on infectious disease went on television to explain that going to school isn’t dangerous for anyone, they would send their own kids. Watch the news anchors’ reaction.

(BEGIN VIDEO CLIP)

UNIDENTIFIED MALE: Would you let your kids go back to school?

UNIDENTIFIED FEMALE: I will. My kids are looking forward to it.

UNIDENTIFIED MALE: Yes. Period. Absolutely.

UNIDENTIFIED FEMALE: Absolutely. As much as I can.

UNIDENTIFIED MALE: Without hesitation?

UNIDENTIFIED FEMALE: Without hesitation. Yes.

UNIDENTIFIED MALE: I have no concerns about sending my child to school in the fall.

UNIDENTIFIED FEMALE: I would let my kids go back to school.

JOHN TORRES, NBC NEWS CORRESPONDENT: Dr. John Torres, NBC News.

UNIDENTIFIED MALE: They all said yes.

(END VIDEO CLIP)

CARLSON: “They all said yes,” says the newsreader, feigning shock. Can you believe that? Doctors have concluded their own children should go to school. They must be crazy. They are crazy. What do doctors know about coronavirus?

What was this about? And of course, you know the answer. It was about Donald Trump.

Donald Trump in this case agreed with the doctors. Therefore, the doctors had to be mocked and ignored. Here’s what the President said about schools in July.

(BEGIN VIDEO CLIP)

DONALD TRUMP (R), PRESIDENT OF THE UNITED STATES: We have to open our schools. Open our schools. Stop this nonsense. We open our schools.

(END VIDEO CLIP)

CARLSON: “Stop this nonsense. We reopen our schools.” Now in point of fact, as a scientific matter that turned out to be sound policy based on sound data. But the media told us the exact opposite of that. One headline at CNN warned of, quote, “The very clear dangers of Donald Trump’s push to reopen schools.” Google didn’t censor that as misinformation, it should have.

Another headline called out, quote, “Donald Trump’s mind-bending logic on school reopenings.” Mind-bending logic. Those damn data again, Joe Biden’s campaign didn’t want to hear it. They didn’t want you to hear it either. School was dangerous. Period.

Donald Trump claimed the opposite. Therefore, it was too dangerous to send your kids or for you to decide to send them. Watch.

(BEGIN VIDEO CLIP)

UNIDENTIFIED MALE: Ignoring how the virus spreads, risking teachers and parents’ lives, going against the advice of experts.

TRUMP: It’s had very little impact on young people.

UNIDENTIFIED MALE: Do you trust him to do what’s best for our children? Because this is not a test.

(END VIDEO CLIP)

CARLSON: Yes, going against the advice of experts. In this country, that’s no longer allowed, even and maybe especially when the experts are completely wrong. What’s the message? The message couldn’t be clearer. They’re not your kids anymore. If they were your kids, you could make the key decisions about their lives, but they’re not.

Those kids, your former kids belong to Tony Fauci now. Tony Fauci, America’s parent. He’ll make the decisions about your kids, thank you very much, in conjunction with the nation’s uber mom, who by the way, is also 80 years old, Mrs. Nancy D. Pelosi.

Watch Mrs. Pelosi fret about the health of our children.

(BEGIN VIDEO CLIP)

DANA BASH, CNN CHIEF POLITICAL CORRESPONDENT: Are you confident that students and teachers will go back safely to school in the fall?

REP. NANCY PELOSI (D-CA): No, I think what we heard from the Secretary was malfeasance and dereliction of duty. This is appalling. They’re messing. They’re messing — the President and his administration are messing with the health of our children.

Going back to school presents the biggest risk for the spread of the coronavirus.

(END VIDEO CLIP)

CARLSON: If that’s not criminal, what she just said, we may need to redefine what it means to commit a crime. Sixty million school-aged children affected by a decision that was wrong and many of them hurt for life, but we just blow right past it and allow political leaders like that to blow right past with phrases like the health of our children.

What happens when you lock children in their rooms in front of screens and prevent them from experiencing human contact? Has Nancy Pelosi ever been asked that question? Has she ever wondered about the answer?

According to the Centers for Disease Control, a total of 522 children between the ages of five and 14 died of suicide in 2017. And that same age group, only 42 children have died from the coronavirus so far this year. What are those suicide numbers going to look like if we continue to take Nancy Pelosi’s advice about the health of our children? We’re going to have some indications of that. Future years will reveal the whole picture and you can be certain it’ll be horrifying.

But for right now, with incomplete data, here’s what we know. In St. Paul, Minnesota, for example, 40 percent of all grades given this year have been Fs, and you can be certain they are grading lightly, but it’s still double the normal amount of failures.

In Fairfax County, Virginia, the number of middle and high school students with failing grades in two or more classes has increased by 83 percent. The number of students with disabilities who are failing two or more classes has increased by more than 100 percent.

In a lot of school districts, huge numbers of kids never even registered for online classes. Do you have kids? Do you know anyone who does? They are learning nothing. Those are real consequences.

If you want to know the health of a society, look at its young people. Look at its schools. These are obvious points that are being roundly ignored and anyone who makes them is attacked for making them. We’re going to look back on this woman in shame.

Back in June, we interviewed Dr. Scott Atlas. He was then a member of the White House’s Coronavirus Taskforce. He was one of the very few people then or now brave enough to make a simple point. Here’s what he said.

(BEGIN VIDEO CLIP)

DR. SCOTT ATLAS, FORMER MEMBER OF WHITE HOUSE CORONAVIRUS TASKFORCE: But the point about the schools is really critical because this is the most irrational public policy probably in modern history. Children have virtually zero-risk of getting a serious complication, virtually zero risk of dying. You don’t lock down the children because you are personally afraid. It is totally outrageous.

(END VIDEO CLIP)

CARLSON: Dr. Scott Atlas was attacked as a monster for saying that. Really attacked. Dr. Tony Fauci, by contrast, was deified. Signs throughout Northwest DC said I believe, Dr. Fauci, but the truth is that Scott Atlas was right and Dr. Fauci was revealed as a power-mad incompetent.

That’s not our opinion, by the way, the data prove it.",BreitBart,-1
David Mamet Calls Out ‘Experts’ and Questions Lockdowns: ‘The Virus Here Is Government’,['David Ng'],"Acclaimed playwright David Mamet has added his distinctive voice to the growing chorus of dissenters who are questioning the effectiveness of government-mandated masks and lockdowns to combat the coronavirus.

In a recent op-ed for the Wall Street Journal, the Glengarry Glen Ross playwright slams the so-called “experts” and advisers whose counsel has led to the destruction of large swaths of the U.S. economy. These people will likely never pay the price for their errors, but everyone else will, he noted.

“The virus here is government—or at least the incompetents who advise our rulers and cannot admit the legitimacy of dissension. Absent intervention, this virus may eventually kill the host organism,” Mamet wrote.

Those closest to the boss will have the most influence—and they often keep it, even in failure, writes David Mamet https://t.co/i9OVqCbQvQ — WSJ Editorial Page (@WSJopinion) November 28, 2020

“We all have to trust others for their expertise, and we all make mistakes. The horror of a command economy is not that officials will make mistakes, but that those mistakes will never be acknowledged or corrected.”

The playwright noted that experts have issued contradictory messages about the effectiveness of masks, citing the prestigious New England Journal of Medicine that published an article saying masks are useless outside health-care facilities, only to issue a quasi-retraction.

He also cited the example of a friend who owns a restaurant and is going broke. “One is ‘permitted’ to sit at his tables and eat without a mask. Indeed, how would one eat while wearing one? Does the virus know that one is sitting down?”

David Mamet compares today’s coronavirus advisers to failed advisers of the past, citing the case of Prof. Frederick Lindemann, a confidant to Winston Churchill. During World War II, Lindemann downplayed the idea that the Germans were developing a rocket capable of bombing London, which became the V-2. He was wrong, but never paid a professional price for his mistake.

Mamet also cites Joseph Stalin’s science adviser, Trofim Lysenko, who came up with the idea of training crops to grow in winter. It was a disaster that contributed to mass starvation in communist Russia and China.

The playwright even brings up the debate around climate change. “Now we have climate change and its attendant alarmists,” he added. “The news media, backed by those parts of the ‘scientific community’ the media chose to honor, presented this analysis as though it were indisputable fact. In fact, it was riddled with problems.”

Today, millions of people face economic ruin as a result of the coronavirus and the policies crafted by experts who are advising the government, he wrote.

“A pandemic was allowed to destroy the American economy. Tens of millions are driven out of work, cover their faces, and walk down the streets in fear of their neighbors.”

Follow David Ng on Twitter @HeyItsDavidNg. Have a tip? Contact me at dng@breitbart.com",BreitBart,-1
