Title,Author,Text,Resource,Label
Prince Harry Climate Plea: 'What If Every One of Us Was a Raindrop?',['Simon Kent'],"Prince Harry admits his world view has changed since parenthood, urging humans to care more and be “like raindrops” which “relieve the parched ground” to tackle climate change.

The Duke of Sussex, 36, who lives with his family on a $14.65-million estate in California, spoke of his passion for nature and Africa during a television exchange to feature in an upcoming documentary, continuing his love of offering advice on climate matters that peaked 12 months ago with his enthusiastic endorsement of Greta Thunberg, as Breitbart News reported.

Speaking about his son Archie, now 19 months, the Daily Mail reports Harry said: “Being in nature is the most healing part of life, I truly believe that’s one reason why it’s there.”

Prince Harry, Meghan Markle Flying (Again) to Africa with Climate Message https://t.co/prMEmC9xdH — Breitbart London (@BreitbartLondon) September 22, 2019

He then said “the moment you become a father, everything really does change because then you start to realise, well, what is the point in bringing a new person in to this world when they get to your age and it’s on fire?”

Harry spoke of the importance of “putting the dos behind the says” when it comes to tackling climate change and conservation, before imploring everyone on the planet to examine their souls, musing:

Every single raindrop that falls from the sky relieves the parched ground. What if every single one of us was a raindrop, and if every single one of us cared?

Harry reflected on the “universally tough year” everyone has experienced during the coronavirus epidemic, adding he has found comfort in nature, which he believes is the “most healing part of life.”

“Someone said to me right at the start of the pandemic, ‘It’s almost as though Mother Nature has sent us to our rooms for bad behaviour’,'”he observed.

The Duke has long stressed his concern for the future of the planet, offering thoughts and solutions along with active campaigning while flying around the globe.

Barefoot Prince Harry Warns World: Climate Change Must Be Addressed https://t.co/9q7Zkbfqau — Breitbart London (@BreitbartLondon) August 1, 2019

As Breitbart News reported, in September last year he stood on African soil and declared the world was in a state of “emergency” and “losing’” the battle against climate change, an event he declared that “cannot be denied.”

The Duke stressed saving the environment was a race against time, adding everyone should look to young people like Greta Thunberg for inspiration and guidance: “Led by Greta, the world’s children are striking.”

Just weeks before, a barefoot duke stood before an elite audience of business leaders and celebrities gathered at Google’s annual deluxe retreat in Sicily to warn immediate action is needed to avoid an approaching climate catastrophe.",BreitBart,-1
Pope Francis Calls for ‘New Social Justice’ to Challenge Utopia,['Thomas D. Williams'],"ROME — Pope Francis called for a “new social justice” Sunday in which all well-intentioned people will challenge the reigning utopia.

Addressing “social justice judges” from the African and American continents via streaming, the pope congratulated them for their commitment to “social rights,” asserting that the very fact that men and women “come together to think about their work and to build the new social justice is, without a doubt, excellent news.”

The pontiff, who has been a vocal proponent of a “great reset” after the coronavirus pandemic, urged his hearers to “not lose sight of the distressing picture in which a small part of humanity lives in opulence, while an increasingly large number lives without dignity with their most elementary rights ignored or violated.”

“We cannot think disconnected from reality,” he said. “And this is a reality that you must bear in mind.”

Pope Francis has called on Christians to break down walls and embrace a love without borders in a new encyclical letter released on Sunday. https://t.co/6THB1aGBPb — Breitbart News (@BreitbartNews) October 4, 2020

The pope insisted that social justice is “a collective work” in which all people of good will challenge the reigning utopia. “Justice is a task that has to be conquered every day, because the imbalance is a temptation of every minute,” he said.

Justice also involves overcoming the temptation to ignore others, “especially the weakest,” Francis said, lamenting that “we have become used to sidestepping or ignoring situations until they impact us directly.”

“Unconditional commitment means taking charge of the pain of the other and not slipping into a culture of indifference,” he added.

In their task of bringing about a “new social justice for the planet,” the pope urged his hearers to pay attention to history, to draw inspiration from “the struggles, the triumphs, and the defeats” of those who gave their lives for “a full and integrated humanity.”

This effort will only succeed if it takes place as a grassroots initiative involving all people, “without pretending to be an enlightened elite,” Francis said, because “what God asks of us believers is to be God’s people, not God’s elite.”

In the battle for social justice solidarity is necessary to overcome “the structural causes of poverty, inequality, lack of work, land and housing,” he said.

Pope Francis reflected Wednesday on the importance of the intercession of the Virgin Mary, proposing that without her intervention at the wedding feast in Cana the guests would have drunk milk rather than wine. https://t.co/zwMeQtwEtI — Breitbart News (@BreitbartNews) November 19, 2020

We must fight, he said, “against those who deny social and labor rights” and “against a culture that leads people to use others, to enslave others, and ends up taking away the dignity of others.”

When we give essential things to the poor, he said, “we do not give them our things, or that of third parties, but we give them back what is theirs.”

The Christian tradition “never recognized the right to private property as absolute and untouchable,” he added, but “always emphasized its social function in any of its forms.”

“There is no social justice that can be based on inequity, which involves the concentration of wealth,” he said.

Follow @tdwilliamsrome",BreitBart,-1
Coronavirus Robs Biblical Bethlehem of Christmas Cheer,['Breitbart News'],"BETHLEHEM, West Bank (AP) — The coronavirus has cast a pall over Christmas celebrations in Bethlehem, all but shutting down the biblical town revered as Jesus’ birthplace at the height of the normally cheery holiday season.

Missing are the thousands of international pilgrims who normally descend upon the town. Restaurants, hotels and souvenir shops are closed. The renowned Christmas tree lighting service will be limited to a small group of authorized people, as will church services on Christmas Eve.

“Bethlehem is dead,” said Maryana al-Arja, owner of the 120-room Angel Hotel on the outskirts of Bethlehem.

The hotel was the site of the West Bank’s first coronavirus outbreak — when a group of Greek tourists came down with the virus last March.

She kept her 25 workers on staff for several months but ultimately couldn’t continue to pay them. Al-Arja, who herself was infected with the virus, said she has been forced to close the hotel and lay off the entire staff because there is no sign of the pandemic ending or tourists visiting anytime soon.

“We had 351 tourist groups booked in our hotel this year, each one 150 people,” she said. “But they all canceled.”

Elyas al-Arja, the head of the city’s hotel association, said Bethlehem received some 3 million tourists in 2019. With Israel, the main entry point for international visitors to the region, banning tourists because of the coronavirus crisis, and the West Bank’s border crossing with Jordan closed to foreigners, that number is close to zero this year, he said.

“Sixty percent of the city relies on tourism, and their income disappeared when the tourists disappeared,” said al-Arja, a cousin of the Angel Hotel owner.

The Ambassador Hotel, which is located near the Church of the Nativity, built on the site where Christians believe Jesus was born, has reopened one floor in hopes that some local visitors may want to come celebrate in the coming weeks.

Mahmoud Tarman, the hotel’s receptionist, said the Ambassador has brought back eight of its 60 workers to serve local guests. But with the West Bank’s economy devastated by repeated lockdowns, it remains unclear how many people will come.

“At this time of the year, this empty hotel would be bustling with life. But as you see, there is no life, not even a Christmas tree yet,” he said as he pointed at the empty lobby.

The Palestinian Authority, which administers parts of the Israeli-occupied West Bank, this week imposed a new nighttime lockdown to help contain a spike in coronavirus cases. People must remain indoors from 7 p.m. until 6 a.m., and Bethlehem is included in the lockdown.

Officials say the lockdown could be extended through Christmas and into the new year if the infection levels don’t come down. The Health Ministry has reported a total of about 65,000 coronavirus cases in the West Bank, and over 620 deaths.

Bethlehem’s mayor, Anton Salman, said the city had planned to receive 3,000 invited guests, including local scout troops and musical bands from around the world that normally entertain visitors during Christmas Eve festivities.

He said the famed Christmas tree lighting, scheduled on Thursday, will be limited to just 15 guests, including local mayors, the district governor and the Latin Patriarch and other clergy. The 85-year-old Palestinian president, Mahmoud Abbas, who usually joins the celebration, has been invited but has not said whether he will attend.

Midnight Mass, a solemn event led by the Latin Patriarch that is usually attended by religious leaders, local VIPs and hundreds of pilgrims from around the world, has also been scaled back, Salman said. He said officials are still working on the guest list, but it is expected to include religious leaders and some foreign diplomats. The event will be closed to the general public but broadcast live for people to watch.

“No one can hold the responsibility of inviting large numbers of people to Christmas events,” he said. “Nothing will be the same during the pandemic.”",BreitBart,-1
SF Archbishop Says New Church Closures Violate Religious Freedom,['Thomas D. Williams'],"San Francisco Archbishop Salvatore Cordileone said this weekend a new ban on worship violates a “a natural and a Constitutional right.”

Archbishop Cordileone objected to the state’s lumping together of religious worship with “non-essential indoor activities such as gyms, movie theaters, and museums” while arbitrarily allowing “for indoor retail at 25 percent capacity and permits massage parlors, hair and nail salons, and tattoo parlors to operate indoors.”

In his statement, the archbishop criticized a new health order from the state of California that places San Francisco and San Mateo Counties into a more restrictive “purple” tier of coronavirus restrictions, which unfairly denigrates the right to religious worship.

“This is precisely the kind of blatant discrimination to which the Supreme Court gave injunctive relief in New York,” Cordileone said, in reference to last Wednesday’s SCOTUS ruling barring the state from enforcing certain attendance limits at houses of worship.

Even in a pandemic, “the Constitution cannot be put away and forgotten,” Justice Neil Gorsuch wrote in the 5-4 decision. “The restrictions at issue here, by effectively barring many from attending religious services, strike at the very heart of the First Amendment’s guarantee of religious liberty.”

England’s faith leaders have united in calling on the UK government to permit public worship during the forthcoming lockdown in England, insisting that such worship is “essential.” https://t.co/FohO0VnRAE — Breitbart News (@BreitbartNews) November 3, 2020

The San Francisco archbishop insisted in his statement that for Catholic Christians, worship of God and the reception of the sacraments are “essential” activities.

“The government is demoting worship to the same status as watching a movie: ‘non-essential,’” Cordileone said. “But worship is both a natural and a Constitutional right. My people want to receive the Body and Blood of Christ; they need it, and have every right to be free to do so.”

Cordileone also insisted that his archdiocese has adhered scrupulously to measures mandated to curb the spread of the coronavirus.

“Catholics in San Francisco are absolutely committed to public safety in conducting worship services,” he said. “Our protocols require masks, social distancing, sanitation and ventilation.”

“But the government still chooses to treat worship as less important than shopping for shoes,” he added.

While declaring that he is “deeply sympathetic to public health concerns about a surge in COVID hospitalizations,” the archbishop also noted that “we know of no cases of transmission of the virus as a result of in-person worship inside of our churches.”

Follow @tdwilliamsrome",BreitBart,-1
No Twitter ‘Fact Check’ Warning on Chinese Official’s Fake Photo of Australian Soldier Beheading Child,['Simon Kent'],"Twitter on Tuesday rejected Canberra’s calls to remove a Beijing official’s gruesome tweet targeting Australian troops, choosing instead to stand with the Chinese Communist Party (CCP).

As Breitbart News reported, Australian Prime Minister Scott Morrison has demanded Beijing apologize after a top CCP official posted an obviously contrived image on Twitter depicting an Australian soldier with his knife to a child’s throat, appearing to prepare to behead the victim.

Morrison described the post by the official Twitter account of Chinese foreign ministry spokesman Zhao Lijian as an “outrageous and disgusting slur” at a virtual news conference in Canberra on Monday.

Shocked by murder of Afghan civilians & prisoners by Australian soldiers. We strongly condemn such acts, &call for holding them accountable. pic.twitter.com/GYOaucoL5D — Lijian Zhao 赵立坚 (@zlj517) November 30, 2020

AFP reports Twitter said it had since marked the tweet as “sensitive,” but added comments on topical political issues or “foreign policy sabre-rattling” by official government accounts were generally not in violation of its rules.

Twitter is banned for most citizens in China and Beijing has for decades been accused of widespread human rights abuses.

Some Australian allies expressed concern over the tweet, including New Zealand Prime Minister Jacinda Ardern, with the support coming as Australia looks to strengthen its alliances in the Indo/Pacific region as a guard against Beijing’s increasingly strident diplomacy.

Australia will join Japan in a regional defense pact designed to bolster their standing against Beijing’s growing military power and assertiveness in the Indo-Pacific region. https://t.co/ZYhlX6LwSA — Breitbart News (@BreitbartNews) November 10, 2020

“In this case an image has been used that is not factually correct, that is not a genuine image, so we have raised that directly with Chinese authorities,” she told reporters.

The French foreign affairs ministry said the post was “unworthy of the diplomatic standards we have the right to expect from a country like China”.

A spokesperson for the Chinese embassy in Canberra dismissed the criticism, instead accusing Australia of making too much of the incident.

“The rage and roar of some Australian politicians and media is nothing but misreading of and overreaction to Mr. Zhao’s tweet,” the spokesperson said.

﻿

The embassy suggested Australian officials were attempting to “deflect public attention from the horrible atrocities by certain Australian soldiers” and “stoke domestic nationalism.”

AFP contributed to this report",BreitBart,-1
UK Minister: You Might Be Banned from Venues Without Vaccine Passport,['Victoria Friedman'],"The UK’s new vaccine minister Nadim Zahawi has said that while coronavirus vaccinations will not be mandatory, Britons may be barred from going to the cinema or getting on an aeroplane without it if service providers demand proof of inoculation.

Conservative MP Nadim Zahawi is the newly-appointed Minister for COVID Vaccine Deployment and will oversee the rollout of the vaccination in England.

Mr Zahawi said that of the three vaccines currently being developed in the UK — by Oxford/AstraZeneca, Pfizer/BioNTech, and Moderna — the Pfizer product is the most far along and likely to be widely rolled out first.

Speaking to BBC Radio 4’s World at One on Monday, Mr Zahawi confirmed that the vaccine would not be compulsory and would remain voluntary.

However, the demand for “immunity passports” to secure service — such as by Australian airline Qantas — may make the jabs effectively compulsory by any other definition.

When host Sarah Montague asked if could follow that British businesses could demand an immunity passport before a person can go to a stadium to watch a football match, the COVID vaccination minister did not deny such an outcome, rather adding that the government was looking for a system comparable to the NHS’s ‘Test and Trace’ app, which tracks the spread of coronavirus.

Mr Zahawi said: “We are looking at the technology and of course a way of people informing their GP that they’ve been vaccinated.

“But also I think you’ll probably find that restaurants, bars, and cinemas and other venues — sports venues — will probably also use that system as they’ve done with the app.”

Minister ‘Can’t Rule Out’ THIRD Lockdown, Says No Normality Until Summer https://t.co/sUwnCaISlR — Breitbart London (@BreitbartLondon) November 30, 2020

The Times had reported on Monday that the NHS is working on updating the Test and Trace app to include the information in its data architecture so that Britons can confirm their inoculation status.

The vaccine tsar admitted that without the availability of Big Government’s tech, there would be no demand for such ‘COVID passports’ by service providers, saying: “In many ways, the pressure from both ways: from service providers who will say, ‘Demonstrate to us that you’ve been vaccinated,’ but also we will make the technology as easy and accessible as possible.”

Sarah Montague asked Mr Zahawi whether or not it would become “virtually impossible to do anything if you don’t have the vaccine”, with the minister responding: “I think people have to make a decision, but I think you’ll probably find many service providers will want to engage in this in the way they did with the [Test and Trace] app.”

The minister’s comments come after reports that the government is also working on coronavirus stamps for passports in order to boost the travel and tourism industry. The government is also reportedly working on so-called “freedom passes” for those who have tested negative for the Chinese coronavirus, which could allow them to be free from having to wear a mask or to visit family members during lockdowns.

Former Brexit Party MEP, now Lady Fox of Buckley in the House of Lords, Claire Fox responded to Zahawi’s remarks on Monday evening, saying: “When Boris assured us that no-one would be forced to vaccinate, he forgot to add, ‘but if you don’t, you will be effectively prevented from being part of the public sphere, ever’. Public shaming next? I want to be an enthusiastic advocate for vaccines. This COERCION doesn’t help.”",BreitBart,-1
Farage: China is ‘Licking its Chops’ at the Thought of a Biden Presidency,['Kurt Zindulka'],"The Chinese Communist Party (CCP) is “licking its chops” at the thought of a Joe Biden presidency, warned Brexit leader and longtime ally of President Donald Trump, Nigel Farage.

Mr Farage argued that China “has ruined the world in 2020” through its handling of the Wuhan coronavirus, for which it should be forced to pay “very heavy reparations”. Yet, he predicted that with Joe Biden preparing to ascend to the presidency, the CCP will continue its push for global supremacy.

“China’s economy is powering ahead, and its leaders are bullying weaker Western nations,” Farage wrote in Newsweek. Indeed, British newspaper The Times reports Tuesday that the Chinese economy is on track to be the first worldwide to bounce back from the impacts of the pandemic.

“With Trump all but gone from the White House, and faltering Joe Biden preparing to move in, it now looks as though China’s quest for world domination is back on track. What a calamity,” Mr Farage lamented.

Mr Farage went on to recall a speech he gave during a Trump campaign rally in Arizona, remarking that the line which resonated with the crowd the most was when he asked the crowd: “Who else among Western leaders has the courage to stand up to the rapacious Chinese Communist Party if not Donald J. Trump?”

“The crowd roared, knowing full well that Biden would not show such strength in the face of the Chinese threat,” Farage said.

Farage Predicts UK-Style Postal Voting Fraud Will Be Found, Trump Will Be Back in 2024 If He Loses https://t.co/lUuq4BfATB — Breitbart London (@BreitbartLondon) November 5, 2020

Mr Farage said that in the wake of Joe Biden’s apparent victory, China has “wasted no time in trying to reassert its authority over the world”, noting the increasingly tough rhetoric coming from the communist government and state-linked businesses.

He pointed to statements from Chinese Foreign Ministry spokesman Zhao Lijian in November, in which he threatened the Five Eyes intelligence alliance of the United States, UK, Canada, Australia, and New Zealand, after the bloc criticised the CCP’s move to ban four opposition leaders from the Hong Kong Legislative Council.

Mr Zhao said: “No matter how many ‘eyes’ you have, be careful not to be poked and get blind by harming China’s sovereignty, security and development interests.”

Farage characterised the rhetoric as “the language of a thuggish mafia don,” questioning: “Who would wish to have anything to do with an individual who spoke in such a way?”

The veteran Brexit campaigner went onto decry the veiled threats from Hauwei Vice President Victor Zhang, who said that the UK should reconsider its ban on Huawei equipment from its 5G networks, claiming that the decision was motivated by pressure from the Trump administration during its trade war with China, rather than for security purposes.

The chief technology officer for Huawei, Paul Scanlan also said in November that the company will be seeking a “reset” of relations with the United States and other Western powers under a Biden administration.

Nigel Farage: Only Trump Has Stood up to China, But Citizens of the West Must Stand up Next https://t.co/q8LRA7Gjtd — Breitbart London (@BreitbartLondon) April 20, 2020

Last week, the Global Times — one of China’s more belligerent state-run mouthpieces — ran an opinion article, in which they told Mr Biden to abandon the “reckless pursuit of the Indo-Pacific strategy” of President Trump and to put a halt to “stirring up the region” by confronting Beijing’s expansionism in the region.

The Chinese Communist paper went on to suggest that Biden accept his “historic responsibility” and to “explore and create an unprecedented win-win situation” in partnership with China”.

While the Biden campaign has paid lip-service to the idea of confronting the CCP, Mr Biden’s pick for National Security Adviser, Jake Sullivan has openly advocated for the United States to support the “rise” of China.

“We need to strike a middle course – one that encourages China’s rise in a manner consistent with an open, fair, rules-based, regional order,” Sullivan said in 2017.

The Obama administration alumn went on to argue that for the good of the global economy, a thriving China is critical, though he did say that it was important to determine the “parameters of the system within which China is rising.”

Farage: ‘The Chinese State Has Conducted Murder on a Vast Scale’ https://t.co/v72JKC2qQF — Breitbart London (@BreitbartLondon) July 21, 2020

Follow Kurt Zindulka on Twitter here: @KurtZindulka",BreitBart,-1
