Title,Author,Text,Resource,Label
Actor Laverne Cox Claims to Be Victim of Transphobic Attack in L.A.,['Alana Mastrangelo'],"Transgender actor Laverne Cox detailed an attack in which the Orange Is the New Black star’s friend was apparently beaten by a man who “very aggressively asked for the time” in Los Angeles.

“The guy was hitting my friend,” said Cox, who explained in a ten-minute Instagram video what had allegedly happened while the actor and a friend went for a walk in Griffith Park. “We passed this guy, and the guy very aggressively asked for the time,” said Cox, describing the lead-up to the fight between the stranger and the actor’s friend.

Watch Below:

View this post on Instagram A post shared by laverne cox (@lavernecox)

“The friend that I’m with looks at his watch and tells him the time, and then the guy who asked for the time says to my friend, ‘Guy or girl?'” said Cox. “My friend says, ‘Fuck off.'”

After that brief exchange, Cox’s friend and the stranger proceed to fight, according to Cox.

“All of the sudden, the guy is attacking my friend, and I look back — and the guy is, like, hitting my friend, and then my friend is, like, going towards him, and I’m, like, ‘holy shit,’ and I pull out my phone, and I call 911 — to dial 911, and all of the sudden it’s over,” said Cox. “And the guy is gone, and so I put my phone away, and then I’m like, what just happened? It just happened really quickly.”

“It’s not safe in the world,” Cox affirmed. “And I don’t like to think about that a lot, but it’s the truth. It’s the truth and it’s not safe if you’re a trans person. Obviously, I know this well. It’s just really sad.”

“What my friend thinks is that the guy really wanted me to answer so he could, like, you know, spook whether, like, you know, I’m trans or not,” said Cox. “Definitely in shock, definitely triggered,” said Cox, who added that this type of incident has “happened a lot.”

“I mean, it doesn’t always come to blows,” the actor elaborated. “It doesn’t always get physical, but yeah — I’ve had a long history of street harassment in New York, sort of being clocked or spooked, and, you know, sort of called out on the street or whatever. And I just can’t believe that, like, it got physical. I guess I can believe it.”

The Charlie’s Angels actor hadn’t been leaving the house in general due to the coronavirus pandemic, and said “I’m gonna stay inside now, I’m really not going to go out now. Living in fear is, like, not a good thing. It doesn’t matter who you are, you can be, like, Laverne Cox — if you’re trans, you’re gonna experience stuff like this.”

Cox concluded the 10-minute video by stating that it’s important to remember “it’s not your fault” if other people attack you because they don’t want you to “exist in the world” due to being transgender.

“I think it’s important for me to remind myself, and remind you that when these things happen, it’s not your fault,” said Cox. “It’s not your fault that there are people who are not cool with you existing in the world.”

Cox’s received support from many celebrities who commented on the video.

Actress Jamie Chung was among the celebrities who commented, writing: “I’m sorry you and your friend were attacked. This is infuriating. I hope he was reported and you gave them his description.”

Cox did not specify whether or not 911 was called and if there was a police report filed.

You can follow Alana Mastrangelo on Facebook and Twitter at @ARmastrangelo, on Parler at @alana, and on Instagram.",BreitBart,-1
James Corden: Trump Jokes Are About ‘Good Versus Evil’,['Pam Key'],"CBS’s “Late Late Show” host James Corden said Sunday during an interview with “60 Minutes” that he thinks of jokes about President Donald Trump and his administration as “good versus evil.”

Corden said, “I will say that as time’s gone on, as we’ve been living under this administration, I don’t even consider it to be politics. I consider it to be right and wrong. I consider it to be good versus evil.”

He added, “We are more than comfortable talking about anything. We also feel like we’re an entertainment show. Our primary concern is to just try and make you laugh somehow. That’s really what we love to do. And I’ll really stop at nothing to try. It may not always work, but I’ll give it my best shot, you know?”

Follow Pam Key on Twitter @pamkeyNEN",BreitBart,-1
London: Pop Star Rita Ora Hit with Fines for Lavish Birthday Party,['Ben Kew'],"British pop star Rita Ora has admitted to a “serious error of judgement” after she was busted for hosting a lavish 30th birthday party for herself at her restaurant in London.

According to the Daily Mail, the “Hot Right Now” singer invited at least seven friends to the bash at the Casa Cruz restaurant in Notting Hill where they partied “until the early hours” of Sunday morning.

After being alerted to the possible infringement of Britain’s nationwide lockdown measures, the London Metropolitan Police attempted to gain access to the venue at around 9pm on Saturday evening, but with no success.

However, officers continued their investigation into whether an event was taking place, and reportedly slapped Ora with a £10,000 fine for her flouting of the lockdown rules. Ora has since acknowledged her mistake, describing it as a “serious and inexcusable error of judgement.”

“Hello all, I attended a small gathering with some friends to celebrate my 30th birthday,” she posted on her Instagram story as reports began to hit the media. “It was a spur of the moment decision made with the misguided view that we were coming out of lockdown and this would be OK. I’m deeply sorry for breaking the rules and in turn understand that this puts people at risk.”

“This was a serious and inexcusable error of judgement,” she added. “Given the restrictions, I realise how irresponsible these actions were and I take full responsibility.”

A source close to Ora told the Mail: “Rita knows her actions were wrong which is why she has voluntarily paid the £10,000 ($13,367 USD) fine to the council. She hopes this will go some way to making up for her error of judgement.”

Ora’s ignoring of the rules follows countless reports of celebrities and public officials urging the public to abide by lockdown measures imposed as a response to the Chinese coronavirus before being caught violating the rules themselves.

Earlier this month, the cast and crew of the upcoming Matrix 4 film reportedly skirted Germany’s ban on parties and large social gatherings by throwing a party scene within the movie.

According to the newspaper Dild, the some 200 actors and production crew attending the bash at the Studio Babelsberg in Potsdam, Berlin, enjoyed everything from a DJ and pyrotechnics to tattoo stations and food caravans handing out sushi and fancy desserts.

In August, New York Governor Andrew Cuomo allowed musicians and celebrities to skirt the state’s mandatory 14-day quarantine rules so that they could perform at the MTV Video Music Awards.

Follow Ben Kew on Parler, Facebook, or Twitter. You can email him at bkew@breitbart.com.",BreitBart,-1
"UK Govt. Says ‘The Crown’ Viewers Should Be Warned Netflix Show Is Fiction, Not Fact",['Simon Kent'],"The UK culture secretary wants the creators behind the TV series ‘The Crown,’ based on the lives of the Royal Family, to include a warning for viewers up front indicating the show is fiction and not a factual documentary.

“I fear a generation of viewers who did not live through these events may mistake fiction for fact,” Oliver Dowden told the Mail on Sunday.

“Without this, I fear a generation of viewers who did not live through these events may mistake fiction for fact.”

Dowden is expected to write to Netflix this week to express his view. Netflix did not immediately respond to a request for comment, according to a report by The Associated Press.

The fourth series of the drama, which stars Olivia Colman as the Queen, has attracted criticism from some quarters for its depiction of royal events, in particular the breakdown of the marriage of the Prince and Princess of Wales.

The Mail on Sunday has led calls for a disclaimer to be added to the series lest people think they are watching a documentary rather than an interpretative piece of fiction.

Final Volume of Thatcher's Authorised Biography Confirms 'Iron Lady' Backed #Brexit https://t.co/1h2LUe73xG — Breitbart London (@BreitbartLondon) September 28, 2019

Earl Spencer, brother of the late Diana, Princess of Wales, previously told ITV’s Lorraine Kelly he was worried some viewers would take the storylines “as gospel,” the BBC reports.

“I think it would help ‘The Crown’ an enormous amount if, at the beginning of each episode, it stated that: ‘This isn’t true but it is based around some real events’,” he said.",BreitBart,-1
Report: NHS Will Use 'Sensible' Celebrities to Front Vaccines Campaign,['Jack Montgomery'],"Britain’s National Health Service (NHS) will launch a campaign fronted by “very sensible” celebrities to persuade people to take coronavirus vaccines, according to reports.

“There will be a big national campaign [to drive take-up],” a source told the Guardian.

“NHS England are looking for famous faces, people who are known and loved. It could be celebrities who are very sensible and have done sensible stuff during the pandemic.”

The left-wing newspaper says Marcus Rashford, a professional football player who has been harrying the government over issues such as free school meals in recent months, is one of the names being considered.

100 million doses of the Oxford University/AstraZeneca vaccine have been ordered by Boris Johnson’s government, along with several million American-made vaccines

The Guardian reports that the NHS is seeking to recruit “airline cabin crew, firefighters and the jobless” by the “tens of thousands” to administer vaccines via a Kitchener-style ‘Your NHS needs you’ recruitment drive.

Sadiq Khan Demands Minorities Get Preferential Access to Coronavirus Vaccines https://t.co/uKn6Pp9YbN — Breitbart London (@BreitbartLondon) November 19, 2020

“It will be vital that there are clear culturally-tailored communications delivered by trusted local and community leaders, and targeted at the most vulnerable and harder-to-reach communities, and that it is made easy for these populations to access vaccination,” remarked Dr Penelope Toff, who co-chairs the public health medicine committee of the British Medical Association (BMA).

There is concern in some quarters that black and minority ethnic (BAME) people, who are being infected by the Chinese virus at a disproportionate rate, may be particularly reluctant to be vaccinated, with the chief executive of St George’s hospital trust in London, Jacqueline Totterdell, saying she thinks that “there is a lot of anxiety [among staff], and some of the polls we’ve done around south-west London show that as little as 50 per cent of people are willing just to have it without any [assurance about its safety].”

“We might all think people might be rushing to have it, but actually we might find that’s not quite the case,” she added.

UK Government Asks Regulator to Assess Safety of AstraZeneca-Oxford University Vaccine After Dosing Error https://t.co/nDT7Djls91 — Breitbart London (@BreitbartLondon) November 28, 2020

Follow Jack Montgomery on Twitter: @JackBM ontgomery",BreitBart,-1
"Celebrity-Backed Time’s Up Spent Big on Executive Salaries, Little on Victims of Sexual Harassment",['David Ng'],"Time’s Up, the anti-sexual harassment organization created by Hollywood celebrities in the wake of the Harvey Weinstein scandal, has spent big bucks on executive salaries but has skimped on helping actual victims, according to a new report.

The group raised an impressive $3,670,219 during its founding year of 2018, but spent $1,407,032 on salaries and just $312,001 on the Time’s Up Legal Defense Fund for victims of sexual harassment, the New York Post reported, citing tax filings.

In addition, the group reportedly spent tens of thousands of dollars on advertising, and $940,328 on “legal” costs, with the bulk of that figure going to Arnold & Porter Kaye Scholer, the multinational law firm.

Time’s Up boasts a slew of Hollywood celebrities and former Obama associates in leadership roles. The group’s governing board includes former Obama senior adviser Valerie Jarrett, mega TV producer Shonda Rhimes, CNN personality Ana Navarro, as well as actresses Eva Longoria and Ashley Judd.

Tina Tchen, who served as an assistant to former President Obama and chief of staff for Michelle Obama, is currently Time’s Up president and chief executive officer. She is also co-founder of the Time’s Up Legal Defense Fund.

The Time’s Up Foundation’s “global leadership board” includes a bevy of celebrities including Jessica Chastain, Brie Larson, Amy Schumer, Reese Witherspoon, Alyssa Milano, Julianne Moore, Mira Sorvino, and Padma Lakshmi. Oprah Winfrey serves as a “visionary ambassador” for the group.

The Post reported that Time’s Up spent $58,395 on travel and $112,435 on Rally, a public relations firm, during 2018. Charity watchdog groups recommend that non-profits spend 75 percent of their revenue on their mission and 25 percent on administration. Time’s Up spent 38 percent on salaries alone, according to the Post.

Last year, Time’s Up experienced a leadership shake-up after sexual harassment allegations were made against the son of then-president Lisa Borders. Tina Tchen succeeded Borders as the head of the group.

Follow David Ng on Twitter @HeyItsDavidNg. Have a tip? Contact me at dng@breitbart.com",BreitBart,-1
"David Prowse, British Weightlifter Who Played Darth Vader, Passes Away",['Breitbart London'],"LONDON (AP) – Dave Prowse, the British weightlifter-turned-actor who played Darth Vader in the original Star Wars trilogy, has died. He was 85.

Prowse died Saturday after a short illness, his agent Thomas Bowington said Sunday.

Born in Bristol, southwest England, in 1935, Prowse represented England in weightlifting at the Commonwealth Games in the 1950s before breaking into movies with roles that emphasized his commanding size, including Frankenstein’s monster in a pair of horror films.

Director George Lucas saw Prowse in a small part in “A Clockwork Orange” and asked the 6-foot-6-inch (2-metre) actor to audition for the villainous Vader or the Wookie Chewbacca in Star Wars.

Prowse later told the BBC he chose Darth Vader because “you always remember the bad guys.”

Physically, Prowse was perfect for the part. His lilting English West Country accent was considered less ideal, and his lines were dubbed by James Earl Jones.

Prowse was also known to a generation of British children as the Green Cross Code Man, a superhero in a series of road safety advertisements

Ant-Man director Edgar Wright paid tribute to Prowse on Twitter.

“As a kid Dave Prowse couldn’t be more famous to me; stalking along corridors as evil incarnate in the part of Darth Vader & stopping a whole generation of kiddies from being mown down in street as the Green Cross Code man,” he wrote. “Rest in Peace, Bristol’s finest.”",BreitBart,-1
Jon Voight Warns ‘We Are in Great Danger if We Fall Under a Biden Administration’,['David Ng'],"Oscar-winning actor Jon Voight is warning that the United States will be “in great danger” if Joe Biden becomes president, adding that the left is trying to steal the election with fraudulent votes.

The Midnight Cowboy star also slammed California Gov. Gavin Newsom (D) for shutting down the state again. “Gov. Newsom is taking away our freedom, your freedom. He’s a disgrace to mankind.”

Jon Voight made the comments in his most recent video that he posted to Twitter this week: “We’re heading down a street that has no name now. We must not allow our nation to crumble. This is what they want, to destroy America. Let me warn you all that we are in great danger if we fall under a Biden administration.”

Watch below:

Voight, who lives in California, then launched a broadside against Gov. Newsom.

“Our state California is being ruled by a leftist mob — himself, Gov. Newsom is taking away our freedom, your freedom. He’s a disgrace to mankind — he and his relative Nancy Pelosi, who has tried to bring President Trump down,” he said. “Gov. Newsom has destroyed many lives of people who depended on their businesses and now he want to shut down again. He is a lie like all the left that are trying to destroy the USA.”

Voight continued: “I ask all to fight this battle now. To get them all out. I’ve been attacked by my fellow peers, saying I am preaching violence. When the truth is they all are. The left are burning and destroing our cities. We are willing to fight for freedom. Not freedom to burn down our flag, but to raise her up, with the glory of this land of the free. But the left are trying to stop these truths.

“Let us bring justice to the Supreme Court. Let them see how corrupt the left is with their fraudulent votes. Let the truth show itself, that President Trump is the only man that can save this nation. Let us fight this evil now and know that God’s truths will expose them all. Let me ask all to pray in the name of Jesus, Moses, and all saints for their hands of safety to be on us now. The way in which we’re being targeted will be hard to fix. But with all your love and prayers and truths, we can win this battle against this evil force that has taken over this country.”

Voight concluded: “We must get Gov. Newsom out. He is destroying the people’s freedom. We must remember who we are. We are a nation that fought the Civil War and we won that battle. Let’s not give up. God bless.”

In his recent videos, Voight has called Joe Biden “evil” and has expressed support for President Trump’s fight against Biden’s claim to victory in the presidential election.

Follow David Ng on Twitter @HeyItsDavidNg. Have a tip? Contact me at dng@breitbart.com",BreitBart,-1
Actor Faizon Love Sues Universal for Cutting Black Stars Out of ‘Couples Retreat’ Publicity Posters,['Alana Mastrangelo'],"Actor Faizon Love is suing Universal Studios for cutting him and his fellow black co-star Kali Hawk out of international publicity posters for the 2009 film, Couples Retreat.

The 52-year-old actor filed a lawsuit on Wednesday stating that he was “aghast” when he saw himself and Hawk removed from publicity posters overseas, according to a report by The Hollywood Reporter.

“Universal Studios had no problem featuring Black actors in the comedic film. But when it came to publicizing the film to international audiences, Universal Studios chose to segregate the motion picture’s White and Black actors…” the lawsuit states. “Rather than enjoy maximum visibility with the film’s release, Mr. Love was demoted to the proverbial ‘Invisible Man,’ as penned by Ralph Ellison,” the complaint continued, referring to Ralph Ellison’s civil rights novel.

“Although Couples Retreat achieved a first-place box office opening weekend ranking, and went on a spectacular run that grossed more than $171 million worldwide, Universal Studios placed Mr. Love in the back seat of the ride enjoyed by his six White costars,” the suit added.

Universal Studios had apologized when the doctored poster was first exposed, and according to Love, went on to promise him “lucrative, career-making film roles” in the future, which he says have never materialized.

The lawsuit also accuses Universal of fraud, breach of contract, and violation of California’s fair employment act and civil rights law.

The suit goes on to accuse the film’s lead actor Vince Vaughn of telling Love “that making a big deal about his removal from the poster would not be good for his career.”

Love explained his reasoning for filing the lawsuit more than a decade after the film’s release in a tweet on Thursday.

“People ask why now? One because Universal is still using the edited poster to promote the movie overseas, two no one said any thing when they went back ten years and ask [Kevin Hart] to explain his ‘tweet’ that kept him from hosting the Oscars… not one person said why now…” wrote Love.

People ask why now? One because Universal is still using the edited poster to promote the movie overseas, two no one said any thing when they went back ten years and ask @KevinHart4real to explain his ”tweet” that kept him from hosting the Oscars…not one person said why now… — Faizon Love AKA Alvin Tostig (@FAIZONLOVE) November 26, 2020

The actor was referring to comedian and A-list actor Kevin Hart, who stepped down from hosting the 91st Academy Awards in 2018 amid a backlash over the resurfacing of previous gay jokes and tweets.

Love told Variety that he is seeking redress on behalf of black actors who have been mistreated by the industry.

“They have not only hurt me financially, they have hurt me in a deeper way by dismissing me because of my blackness — and they have hurt all Black performers by continuing to perpetuate racism in the movie industry,” said Love. “I want to ensure that future generations don’t have to endure the racism and whitewashing that I have experienced.

You can follow Alana Mastrangelo on Facebook and Twitter at @ARmastrangelo, on Parler at @alana, and on Instagram.",BreitBart,-1
